clean_reviews,y,pred_label
pov pushing faustian inserted article upa cooperation jew extensive enough according former head office counter soviet disinformation usia soviet propaganda work complained zionist membership upa seems complete pov muddy water picture upa organisation friendly jew instead organisation collaborated german exterminating jewish people,0,1
redirect talka voice within album,0,0
wpblp violation removed another reverts placed defamatory uncited material cherokee freedman controversy wpcoi may apply since seem edit african american related article freedman controversy dishonest edit summary top,0,1
anderthals anderthals discription quran anybody thought,0,0
discussion first outdoor tree electric light strange kidding obscure town nc think make much sense especially since sentence immediately preceding establish city electrically lighted outdoor christmas tree early year th century article cited north carolina town read carefully really state tradition outdoor lighted tree specific town began town claim first place tree old enough around though small boy tell neighbor southern california lighted outdoor tree prior one thought remarkable unusual history questionable say least,0,0
come next feel like gotten past dispute stage would say someone post request page unprotection move new version might also mention admin merge naked short sellingworkshop keep page history later tonight really matter talk,0,0
redirect talkthe best apocalypse,0,0
dropping thought would leave little feedback featured picture always put main page noted wppotd example seminude michele merkin used found cheesy wikipediapicture dayunused note several picture used depict much gore scatological nature featured picture rating essentially indicating community feel image high quality high encyclopedic value side note potd seems thanks taking trace pink oboe,0,1
source listed ny mag cbs news fox news interview leighton speaking subject directly teen vogue u weekly tv guide interview article san francisco gate newspaper town leighton grew naples daily news consider reliable source problem want find source validreliable newspaper magazine everything valid sourced removed story life wikipedia encyclopedia fact posted fact,0,0
reason presence template based inconclusiveness user page presence template contested,0,0
ho ho ho merry christmas shoulda known piccirilli brother actiually executed ward pediment sculpture stock exchange happy christmas carptrash,0,1
saw reference added note see note name republic,0,0
hey jim good see around right consensus tending towards delete clear delete two time india source one source time india visible search engine would like relist afd might prefer message,0,0
mere fellow editor would problem since seems let power admin go head issue please read remains talk page need example moderator popular internet discussion board would never ignore valid question user,0,1
gon na help u logged want talk talk page,0,0
look great mar utc,0,0
april utc wikipediacolours much thanks fixingimproving table code reason maybe add info found value commoncss style embedded highlyrepetitively know way around mediawiki asking everywhere cs guru clean redundancy main page wikicode like dont enough already eh many project minion,0,0
dear mokele right tell people die fire ip address used vandilism mean talk people like fact bigger loser person block,1,1
new message last change notice result userarkyan useravraham targeting website result editorial dispute whether include theodore roosevelt view u political corruption unholy alliance page ie unholy alliance phrase used platform progressive party united state written unholy alliance concept elaborated upon autobiography recent edits may reviewed specialcontributionsarkyan specialcontributionsavraham reverted appropriate,0,0
peter roman one place remove argentinian chap prophecy part replace information place coat arm question email tarcisio pietro evasio bertone incharge vatican february march thus prophesy st malachi fulfilled,0,1
rfc pretty much blew respect tried demand give adminship position simple afds invalid filed fixed mistake,0,1
delete material complies wp policyaccording povinterpretationswiki badass woo u,0,1
revert edits,0,0
canonicity general involved long discussion talkstargate device whether stargate movie thing stargate series centrx arguing discussing stargate one article deceitful think argument valid course looking stuff web discovered fan movie apparently consider sg series somehow illegitimate noncanon familiar stargate fan community show feel comfortable adding discussion directly article anyone know detail widespread apparent schism jul utc,0,0
capitalization please stop changing lowercase common noun upper case company company wpmoscaps note wikipedia avoids unnecessary capitalization proper noun first word sentence capitalized much yack,0,0
