clean_reviews,y,pred_label
also sock puppet accountsuprise sincerely man track internet kill,1,1
source needed provided need read articlebut guess read prove even reading article every edit backed source came going provide detail merely civillain editor wikipedia staff member info need within pira text edits actual wikipedia staff member want specific happy provide look obviously antiira hack making thing support bias neither pro anti ira bias merely report fact checking page daily continue submit pira entry far accurate factually supported several time day wish accept fact mine superior version deal reedit regular basis agree incorporate fatcxs mine one article three area number loyalist killed number ira victim broken janes intelligence online cfr irarussianmafia connection documented multiple book newspaper source three thing verifiable remain,0,0
fucker mother fucker nothing block university computer go suck cock,1,1
one many book various band thought cult rocker checked supertramp seek source quote,0,0
hello disgrace humanity stop wasting valuable internet resource killing fucking planet throw pc p like fark kinda life wikipedia sad lonely one lol life short find something better,1,1
explained reasoning block usertalkgwengaleuserprofessionalassassin,0,0
article created album disambiguation page created,0,0
would pretty odd declassified document mention movie created event movie document related declassified document synthesized movie unless want prove conspiracy synthesis odd perfectly valid use document relate historical event verify happened use primary source ideal wikipedia since ideal left talk page someone want research find ideal reference,0,0
retarded bot bot entirely automated wrong leave unattented script running site like idiotic suppose scripting ability perfect ever make proper edits banning help anything dipshit since many ip want,1,1
two reversion hezbollah could explain talk page reverted edit twice,0,0
dislike racism see problem people speaks spanish antisemite,1,0
name yuen lou look variation yuen lo name jackie used sifu opera school,0,0
user talkwikireader archive archive mar,0,0
realize article quite say thought said anyone find citation stating exists proper subfield isomorphic would interested seeing could reinclude clause citation,0,0
cherrypick anything official fact essentially every cnn program doubledigits pmet home pier morgan tonight pmet home erin burnett outfront worst performance demo year ratingscnnhits yearlowb,0,0
directindirect relation correct say technically degree shot elevation reach longest distance degree reach distance degree shot could lowerthan shot considered direct fire higherthan shot considered indirect fire think great explanation one way viewing thing,0,0
title section revert hi office earlier noticed warning restoring title section sorry course revert clarify opened new section indeed alert contributor behaving way line example ownership behaviour described return title section twisted something unrelated one message erased first time see people editing signed contribution talk page look crazy,0,0
noel expert please convince whig history fan lazy mind bonnie prince charlie want dissolve union united kingdom began stuart opposed hanoverian tell whig rewrote history blame everything stuart credited ultimate failure positive contribution foundation great britain stewart tudor blood sovereign realm else kingdom british might well living republic least parliamentarian way even hanoverian heir recognise stuart founded uk please debate thanks,0,0
warning earth would like leave access talk page perhaps six month convince u try inclined making hard continue abusive comment revoke talk page access,0,1
jaeger regardless people decided erens name jaeger like calling light death note raito least anime people dubbing take care correctly pronounce foreing name ie except mikasa jaeger mean hunter german word guess eren series,0,0
thank experimenting wikipedia test worked reverted removed please use sandbox test may want take look welcome page learn contributing encyclopedia link edit reverted found link believe edit reverted please contact talk,0,0
please discus factual accurate biographical information courtney ford vandalism look forward hearing evidence,0,0
think entire article tagged politicized part future trend speculative point scientist learner increasingly using know teacher yes probably make educated guess better anyone else still educated guess also notice totally spewing unnecessary carbon statement think article superbly miss point pollution waste type stupid way go thing better way known making guinea pig planet specie point,0,0
used car expert pageimage thank note image used car expert magazine copyright owner gave permission picture email,0,0
however still error assert work equation handicapped,0,0
